,Disease,Symptoms
731,spontaneous abortion,"spotting or bleeding during pregnancy, sharp abdominal pain, pain during pregnancy, cramps and spasms, lower abdominal pain, pelvic pain, problems during pregnancy, burning abdominal pain, uterine contractions, intermenstrual bleeding, blood clots during menstrual periods, heavy menstrual flow"
732,genital herpes,"skin rash, painful urination, vaginal pain, vaginal discharge, pelvic pain, skin lesion, vaginal itching, groin pain, suprapubic pain, itching of skin, recent pregnancy, skin pain"
733,adjustment reaction,"depression, depressive or psychotic , anxiety and nervousness, excessive anger, hostile behavior, insomnia, low self-esteem, delusions or hallucinations, temper problems, fears and phobias, restlessness, nightmares"
734,gallstone,"sharp abdominal pain, upper abdominal pain, nausea, vomiting, back pain, burning abdominal pain, sharp chest pain, side pain, lower body pain, heartburn, sweating, regurgitation"
735,multiple sclerosis,"fatigue, loss of sensation, headache, dizziness, problems with movement, weakness, leg weakness, paresthesia, disturbance of memory, abnormal involuntary movements, leg stiffness or tightness, focal weakness"
736,zenker diverticulum,"difficulty in swallowing, sharp chest pain, regurgitation, low back pain, sharp abdominal pain, sore throat, constipation, elbow weakness, low back weakness, wrist weakness, feeling hot and cold, nailbiting"
737,fracture of the pelvis,"hip pain, groin pain, back pain, leg pain, ache all over, side pain, problems with movement, knee pain, delusions or hallucinations, difficulty speaking, bones are painful, focal weakness"
738,pneumoconiosis,"cough, wheezing, shortness of breath, fever, insomnia, nasal congestion, vomiting, sore throat, difficulty breathing, dizziness, coughing up sputum, chest tightness"
739,hyperlipidemia,"sharp chest pain, weight gain, lymphedema, smoking problems, leg cramps or spasms"
740,ulcerative colitis,"diarrhea, sharp abdominal pain, blood in stool, nausea, vomiting, burning abdominal pain, rectal bleeding, lower abdominal pain, melena, decreased appetite, swollen lymph nodes, discharge in stools"
741,male genitalia infection,"penis redness, swelling of scrotum, pain in testicles, mass in scrotum, skin growth, abnormal appearing skin, penis pain, bumps on penis, warts, groin pain, irritable infant, swollen abdomen"
742,hpv,"warts, frequent urination, vaginal itching, vaginal discharge, joint pain, hand or finger lump or mass, mass or swelling around the anus, lump or mass of breast, involuntary urination, eyelid lesion or rash, unpredictable menstruation, coughing up sputum"
743,angina,"sharp chest pain, shortness of breath, chest tightness, dizziness, arm pain, lower body pain, palpitations, sweating, irregular heartbeat, increased heart rate, burning chest pain, hot flashes"
744,injury to the spinal cord,"neck pain, neck cramps or spasms, back pain, shoulder pain, headache, throat irritation, retention of urine, foot or toe weakness, arm pain, arm weakness, side pain, drainage in throat"
745,nasal polyp,"nasal congestion, headache, nosebleed, painful sinuses, cough, difficulty breathing, allergic reaction, facial pain, disturbance of smell or taste, frontal headache, hoarse voice, redness in ear"
746,lichen simplex,"skin rash, itching of skin, skin lesion, skin irritation, acne or pimples, vaginal itching, itchy scalp, skin growth, skin dryness peeling scaliness or roughness, loss of sex drive, pain during intercourse, difficulty speaking"
747,trichiasis,"foreign body sensation in eye, eyelid lesion or rash, diminished vision,  of eye, itchiness of eye, pain in eye, eye redness, swollen eye, emotional , back weakness, elbow cramps or spasms, pus in sputum"
748,acariasis,"skin rash, itching of skin, swelling of scrotum, skin lesion, vomiting, elbow weakness, cross-eyed, excessive growth, bowlegged or knock-kneed, feeling hot and cold, wrist weakness, emotional , "
749,colorectal cancer,"sharp abdominal pain, rectal bleeding, blood in stool, pain of the anus, mass or swelling around the anus, drainage in throat"
750,skin pigmentation disorder,"abnormal appearing skin, skin rash, skin lesion, skin moles, acne or pimples, skin growth, itching of skin, skin swelling, skin dryness peeling scaliness or roughness, warts, too little hair, irregular appearing scalp"
751,factitious disorder,"disturbance of memory, depressive or psychotic , depression, loss of sensation, paresthesia, lip swelling, itchy eyelid, wrist weakness, excessive growth, elbow cramps or spasms, elbow weakness, nailbiting"
752,lymphogranuloma venereum,"sore throat, nosebleed, fever, chills, ear pain, vulvar sore, pelvic pressure, knee lump or mass, shoulder swelling, neck cramps or spasms, excessive growth, loss of sex drive"
753,galactorrhea of unknown cause,"bleeding or discharge from nipple, pain or soreness of breast, pelvic pain, weight gain, anxiety and nervousness, back pain, lump or mass of breast, sharp chest pain, burning abdominal pain, cough, low back weakness, emotional , "
754,g6pd enzyme deficiency,"cough, nasal congestion, excessive growth, wrist weakness, elbow weakness, elbow cramps or spasms, feeling hot and cold, emotional , low back weakness, underweight, nailbiting, muscle swelling"
755,nerve impingement near the shoulder,"shoulder pain, knee pain, neck pain, arm pain, shoulder stiffness or tightness, problems with movement, elbow pain, shoulder weakness, hand or finger stiffness or tightness, vulvar irritation, muscle pain, bones are painful"
756,toxoplasmosis,"eye redness, diminished vision, itchy scalp, blindness, irregular appearing scalp, elbow weakness, cross-eyed, excessive growth, bowlegged or knock-kneed, feeling hot and cold, wrist weakness, emotional , "
757,fibroadenoma,"lump or mass of breast, pain or soreness of breast, bleeding or discharge from nipple, arm lump or mass, bones are painful, problems with shape or size of breast, hot flashes, pain during intercourse, back swelling, throat irritation, vaginal dryness"
758,open wound of the hand,"hand or finger pain, hand or finger swelling, skin on arm or hand looks infected, hand or finger stiffness or tightness"
759,missed abortion,"spotting or bleeding during pregnancy, sharp abdominal pain, pain during pregnancy, lower abdominal pain, problems during pregnancy, cramps and spasms, intermenstrual bleeding, blood clots during menstrual periods, heavy menstrual flow, blood in stool, recent pregnancy, infertility"
760,diabetic ketoacidosis,"vomiting, nausea, weakness, sharp abdominal pain, sharp chest pain, diarrhea, depressive or psychotic , decreased appetite, thirst, polyuria, frequent urination, fluid retention"
761,granuloma inguinale,"nausea, sharp chest pain, groin pain, vaginal pain, vulvar sore, loss of sex drive, knee lump or mass, nailbiting, excessive growth, wrist weakness, shoulder swelling, neck cramps or spasms"
762,hemorrhagic fever,"pain in eye, shoulder cramps or spasms, facial pain, ankle pain, wrist pain, pain during pregnancy, excessive anger, joint stiffness or tightness, pain or soreness of breast, knee lump or mass, fatigue, excessive urination at night"
763,obsessive compulsive disorder (ocd),"anxiety and nervousness, depression, depressive or psychotic , obsessions and compulsions, temper problems, hostile behavior, low self-esteem, excessive anger, feeling ill, fears and phobias, hysterical behavior, lack of growth"
764,injury of the ankle,"ankle pain, foot or toe pain, ankle swelling, leg pain, foot or toe swelling, joint pain, foot or toe weakness, leg cramps or spasms, ankle stiffness or tightness, wrist swelling, foot or toe lump or mass"
765,hyponatremia,"weakness, vomiting, nausea, shortness of breath, dizziness, sharp abdominal pain, sharp chest pain, headache, back pain, fever, fainting, seizures"
766,stricture of the esophagus,"difficulty in swallowing, vomiting, regurgitation, lump in throat, sharp chest pain, nausea, difficulty eating, heartburn, coughing up sputum, stomach bloating, problems with movement, recent weight loss"
767,fracture of the ankle,"ankle pain, ankle swelling, leg pain, foot or toe pain, foot or toe swelling, ankle weakness, knee weakness"
768,soft tissue sarcoma,"skin lesion, abnormal appearing skin, skin growth, skin moles, itching of skin, skin dryness peeling scaliness or roughness, leg lump or mass, warts, groin mass, irregular appearing nails, change in skin mole size or color, bones are painful"
769,bone disorder,"back pain, knee pain, leg pain, shoulder pain, bones are painful, leg cramps or spasms, leg weakness, difficulty speaking, hot flashes, stiffness all over, leg lump or mass, muscle stiffness or tightness"
770,epilepsy,"seizures, headache, abnormal involuntary movements, disturbance of memory, difficulty speaking, lack of growth, stiffness all over, eye moves abnormally, muscle weakness"
771,personality disorder,"depressive or psychotic , depression, anxiety and nervousness, hostile behavior, insomnia, excessive anger, low self-esteem, delusions or hallucinations, drug abuse, fears and phobias, temper problems, obsessions and compulsions"
772,shingles (herpes zoster),"skin rash, back pain, skin lesion, itching of skin, ache all over, headache, sharp abdominal pain, side pain, sharp chest pain, abnormal appearing skin, pain in eye, facial pain"
773,tourette syndrome,"abnormal involuntary movements, depressive or psychotic , headache, allergic reaction, drug abuse, sleepiness, abnormal movement of eyelid, excessive anger, delusions or hallucinations, obsessions and compulsions, temper problems, warts"
774,avascular necrosis,"hip pain, knee pain, shoulder pain, drug abuse, bowlegged or knock-kneed, shoulder stiffness or tightness, shoulder weakness"
775,strep throat,"sore throat, fever, cough, headache, vomiting, ear pain, nasal congestion, skin rash, ache all over, difficulty in swallowing, chills, decreased appetite"
776,spinocerebellar ataxia,"problems with movement, dizziness, abnormal involuntary movements, skin rash, fainting, difficulty speaking, headache, blood in urine, foot or toe pain, cough, anxiety and nervousness, disturbance of memory"
777,osteomyelitis,"skin lesion, skin on leg or foot looks infected, hand or finger pain, hand or finger swelling, difficulty speaking, foot or toe swelling, knee swelling, bones are painful, skin on arm or hand looks infected, irregular appearing nails, arm swelling, lymphedema"
778,sjogren syndrome," of eye, diminished vision, ache all over, joint pain, pain in eye, peripheral edema, mouth dryness, spots or clouds in vision, itchiness of eye, difficulty in swallowing, regurgitation, groin pain"
779,adhesive capsulitis of the shoulder,"shoulder pain, shoulder stiffness or tightness, neck pain, ache all over, elbow pain, arm pain, skin on arm or hand looks infected, shoulder swelling, stiffness all over, muscle pain, ankle stiffness or tightness"
780,viral hepatitis,"sharp abdominal pain, abusing alcohol, drug abuse, melena, stomach bloating,  of the kidneys, hand or finger stiffness or tightness, low self-esteem, incontinence of stool"
781,tonsillar hypertrophy,"swollen or red tonsils, abnormal breathing sounds, sore throat, nasal congestion, apnea, cough, redness in ear, hurts to breath, fever, drainage in throat, allergic reaction, difficulty in swallowing"
782,gastritis,"sharp abdominal pain, vomiting, nausea, burning abdominal pain, sharp chest pain, upper abdominal pain, diarrhea, fever, headache, heartburn, vomiting blood, regurgitation"
783,skin cancer,"skin lesion, abnormal appearing skin, skin moles, skin growth, skin dryness peeling scaliness or roughness, skin swelling, itching of skin, irregular appearing scalp, warts, acne or pimples, lip swelling, skin irritation"
784,rheumatic fever,"itchiness of eye, knee lump or mass, bedwetting, excessive growth, pelvic pressure, vulvar sore, eye strain, loss of sex drive, neck cramps or spasms, shoulder swelling, joint stiffness or tightness, nailbiting"
785,aphthous ulcer,"mouth ulcer, fever, sore throat, mouth pain, tongue lesions, toothache, ache all over, skin rash, headache, lip sore, cough, swollen tongue"
786,tonsillitis,"sore throat, swollen or red tonsils, abnormal breathing sounds, nasal congestion, throat feels tight, redness in ear, apnea, diminished hearing, drainage in throat, allergic reaction, lump in throat, throat redness"
787,intestinal cancer,"sharp abdominal pain, diarrhea, neck mass, regurgitation, foot or toe swelling, changes in stool appearance, lump or mass of breast, decreased appetite, throat feels tight, jaundice, mouth pain, pain in testicles"
788,rocky mountain spotted fever,"headache, shoulder cramps or spasms, excessive anger, ankle pain, wrist pain, pain during pregnancy, facial pain, joint stiffness or tightness, pain or soreness of breast, knee lump or mass, pain in eye, fatigue"
789,stomach cancer,"sharp abdominal pain, nausea, vomiting, fatigue, weakness, diarrhea, burning abdominal pain, fluid retention, difficulty in swallowing, constipation, peripheral edema, heartburn"
790,developmental disability,"depressive or psychotic , seizures, hostile behavior, lack of growth, difficulty speaking, temper problems, obsessions and compulsions, delusions or hallucinations, restlessness, excessive anger, antisocial behavior, fears and phobias"
791,acute stress reaction,"anxiety and nervousness, sharp chest pain, headache, depressive or psychotic , depression, insomnia, dizziness, shortness of breath, fatigue, burning abdominal pain, abnormal involuntary movements, chest tightness"
792,delirium,"disturbance of memory, depressive or psychotic , depression, problems with movement, hostile behavior, delusions or hallucinations, abnormal involuntary movements, focal weakness, difficulty speaking, hysterical behavior, disturbance of smell or taste, slurring words"
793,callus,"skin growth, foot or toe pain, skin rash, skin lesion, abnormal appearing skin, acne or pimples, warts, skin dryness peeling scaliness or roughness, skin swelling, irregular appearing nails, foot or toe swelling, itching of skin"
794,guillain barre syndrome,"leg weakness, leg pain, loss of sensation, fever, ache all over, dizziness, paresthesia, hand or finger pain, weakness, difficulty speaking, problems with movement, facial pain"
795,lumbago,"low back pain, back pain, leg pain, neck pain, hip pain, lower body pain, side pain, back cramps or spasms, muscle pain, low back stiffness or tightness, low back cramps or spasms"
796,deviated nasal septum,"nasal congestion, abnormal breathing sounds, headache, allergic reaction, difficulty breathing, painful sinuses, apnea, sore throat, facial pain, frontal headache, plugged feeling in ear, nosebleed"
797,hemangioma,"abnormal appearing skin, skin lesion, skin moles, skin growth, lymphedema, skin swelling, skin dryness peeling scaliness or roughness, skin irritation, lip swelling, irregular appearing scalp, warts, irregular appearing nails"
798,patau syndrome,"joint stiffness or tightness, knee lump or mass, eye strain, excessive growth, pelvic pressure, vulvar sore, bedwetting, loss of sex drive, neck cramps or spasms, shoulder swelling, nailbiting, shoulder cramps or spasms"
799,peripheral arterial disease,"skin lesion, leg pain, foot or toe pain, poor circulation, lymphedema, leg cramps or spasms, feeling cold, hemoptysis,  of the kidneys"
800,chronic back pain,"back pain, low back pain, leg pain, neck pain, hip pain, loss of sensation, side pain, lower body pain, groin pain, back cramps or spasms, leg weakness, back stiffness or tightness"
801,heart failure,"shortness of breath, sharp chest pain, difficulty breathing, peripheral edema, cough, weakness, chest tightness, leg swelling, weight gain, fluid retention, palpitations, hurts to breath"
802,conjunctivitis,"eye redness, pain in eye, cough, nasal congestion, fever, itchiness of eye, swollen eye, white discharge from eye, lacrimation,  of eye, sore throat, coryza"
803,herniated disk,"low back pain, back pain, leg pain, neck pain, loss of sensation, shoulder pain, hip pain, lower body pain, arm pain, paresthesia, leg weakness, arm weakness"
804,rhabdomyolysis,"sharp chest pain, depressive or psychotic , arm pain, fatigue, loss of sensation, leg pain, peripheral edema, weakness, vomiting, ache all over, headache, hoarse voice"
805,breast infection (mastitis),"pain or soreness of breast, lump or mass of breast, abnormal appearing skin, fever, bleeding or discharge from nipple, postpartum problems of the breast, recent pregnancy, chills, bones are painful, skin growth, long menstrual periods, mouth dryness"
806,abdominal aortic aneurysm,"sharp abdominal pain, back pain, shortness of breath, sharp chest pain, side pain, burning abdominal pain, swollen abdomen, palpitations, retention of urine, arm swelling, groin pain, pallor"
807,pulmonary embolism,"shortness of breath, sharp chest pain, difficulty breathing, cough, leg pain, back pain, side pain, weakness, chest tightness, hemoptysis, leg swelling, sweating"
808,conduct disorder,"depressive or psychotic , hostile behavior, excessive anger, seizures, depression, fainting, temper problems, abusing alcohol, restlessness, hysterical behavior, delusions or hallucinations, lack of growth"
809,air embolism,"pain in eye, shoulder cramps or spasms, facial pain, ankle pain, wrist pain, pain during pregnancy, excessive anger, joint stiffness or tightness, pain or soreness of breast, knee lump or mass, fatigue, excessive urination at night"
810,mastectomy,"lump or mass of breast, pain or soreness of breast, problems with shape or size of breast, skin swelling, arm stiffness or tightness, smoking problems, burning chest pain, regurgitation, leg cramps or spasms, swollen lymph nodes, heartburn, hand or finger stiffness or tightness"
811,epididymitis,"pain in testicles, swelling of scrotum, groin pain, sharp abdominal pain, side pain, lower abdominal pain, painful urination, blood in urine, retention of urine, lower body pain, swollen abdomen, mass in scrotum"
812,premature rupture of amniotic membrane,"uterine contractions, fever, weight gain, seizures, spotting or bleeding during pregnancy, coryza, sharp abdominal pain, muscle swelling, low back weakness, elbow weakness, abnormal size or shape of ear, back weakness"
813,molluscum contagiosum,"skin rash, skin swelling, skin lesion, warts, itching of skin, arm lump or mass, abnormal appearing skin, acne or pimples, skin growth, bumps on penis, knee lump or mass, skin dryness peeling scaliness or roughness"
814,necrotizing fasciitis,"leg pain, hip pain, peripheral edema, hand or finger pain, vaginal pain, arm swelling, skin lesion, abnormal appearing skin, leg swelling, elbow cramps or spasms, elbow weakness, excessive growth"
815,benign vaginal discharge (leukorrhea),"vaginal discharge, sharp abdominal pain, vaginal itching, problems during pregnancy, burning abdominal pain, painful urination, pelvic pain, vaginal pain, suprapubic pain, pain during pregnancy, frequent urination, vaginal redness"
816,bladder obstruction,"retention of urine,  of bladder, impotence, frequent urination,  of prostate, suprapubic pain, blood in urine, hesitancy, peripheral edema, involuntary urination, excessive urination at night, bedwetting"
817,melanoma,"skin lesion, abnormal appearing skin, skin moles, irregular appearing scalp, skin swelling, skin growth, swollen lymph nodes, back mass or lump, skin irritation, skin dryness peeling scaliness or roughness, itchy eyelid, skin on arm or hand looks infected"
818,cervical disorder,"sharp abdominal pain, vaginal bleeding after menopause, pelvic pain, vaginal discharge, vaginal itching, intermenstrual bleeding, painful urination, painful menstruation, pain during intercourse, vaginal pain, hot flashes, focal weakness"
819,laryngitis,"sore throat, hoarse voice, cough, nasal congestion, fever, coryza, ear pain, difficulty in swallowing, throat feels tight, allergic reaction, sinus congestion, difficulty speaking"
820,dyshidrosis,"skin rash, skin lesion, skin dryness peeling scaliness or roughness, itching of skin, abnormal appearing skin, back pain, acne or pimples, dry or flaky scalp, foot or toe lump or mass, frequent urination, ankle pain, skin on leg or foot looks infected"
821,poisoning due to opioids,"depressive or psychotic , drug abuse, arm pain, slurring words, dizziness, vomiting, difficulty speaking, abusing alcohol, feeling ill, sleepiness, arm weakness, problems with movement"
822,diaper rash,"diaper rash, skin rash, diarrhea, fever, cough, nasal congestion, vomiting, blood in stool, irritable infant, pulling at ears, redness in ear, temper problems"
823,lichen planus,"abnormal appearing skin, skin rash, itching of skin, skin moles, skin growth, skin dryness peeling scaliness or roughness, difficulty speaking, itchy scalp, mouth ulcer, skin lesion, irregular appearing scalp, acne or pimples"
824,gastroduodenal ulcer,"sharp abdominal pain, vomiting, nausea, burning abdominal pain, upper abdominal pain, vomiting blood, sharp chest pain, headache, blood in stool, changes in stool appearance, melena, heartburn"
825,inguinal hernia,"groin pain, groin mass, sharp abdominal pain, lower abdominal pain, ache all over, swollen abdomen, swelling of scrotum, pain in testicles, mass in scrotum,  of the scrotum and testes, penis redness"
826,eczema,"skin rash, itching of skin, abnormal appearing skin, skin dryness peeling scaliness or roughness, skin lesion, cough, allergic reaction, acne or pimples, skin swelling, irregular appearing scalp, skin irritation, warts"
827,asperger syndrome,"depressive or psychotic , anxiety and nervousness, depression, temper problems, lack of growth, fainting, antisocial behavior, delusions or hallucinations, hostile behavior, excessive anger, obsessions and compulsions, nightmares"
828,mucositis,"fever, mouth ulcer, sore throat, decreased appetite, mouth pain, tongue lesions, gum pain, difficulty in swallowing, vomiting, irritable infant, swollen tongue, tongue pain"
829,paronychia,"hand or finger pain, skin on arm or hand looks infected, irregular appearing nails, hand or finger swelling, foot or toe pain, abnormal appearing skin, skin on leg or foot looks infected, foot or toe swelling, hand or finger lump or mass, sinus congestion, nailbiting, skin dryness peeling scaliness or roughness"
830,open wound of the jaw,"facial pain, lip swelling,  of the face, wrist swelling, mouth pain"
831,white blood cell disease,"fever, vomiting, sharp abdominal pain, nausea, cough, diarrhea, weakness, fatigue, chills, fluid retention, mouth pain, heartburn"
832,kaposi sarcoma,"leg pain, foot or toe pain, cough, lip swelling, skin lesion, depression, sharp abdominal pain, elbow cramps or spasms, elbow weakness, excessive growth, underweight, low back weakness"
833,spondylolisthesis,"low back pain, back pain, leg pain, hip pain, lower body pain, neck pain, loss of sensation, paresthesia, problems with movement, leg weakness, leg cramps or spasms, pain or soreness of breast"
834,pseudotumor cerebri,"headache, diminished vision, dizziness, pain in eye, fluid retention, hot flashes, skin swelling, diminished hearing, regurgitation, spots or clouds in vision, abnormal involuntary movements, slurring words"
835,conjunctivitis due to virus,"eye redness, pain in eye, itchiness of eye, fever, swollen eye, nasal congestion, white discharge from eye, cough, lacrimation, coryza, eye burns or stings, diminished vision"
836,open wound of the nose,"headache, nosebleed, facial pain, hot flashes, sleepiness, sore in nose, diminished hearing, neck weakness, knee weakness"
837,hypertensive disease,"pain chest, shortness of breath, dizziness, asthenia, fall, syncope, vertigo, sweat, sweating increased, palpitation, nausea, angina pectoris, pressure chest"
838,diabetes,"polyuria, polydypsia, shortness of breath, pain chest, asthenia, nausea, orthopnea, rale, sweat, sweating increased, unresponsiveness, mental status changes, vertigo, vomiting, labored breathing"
839,depression mental,"feeling suicidal, suicidal, hallucinations auditory, feeling hopeless, weepiness, sleeplessness, motor retardation, irritable mood, blackout, mood depressed, hallucinations visual, worry, agitation, tremor, intoxication, verbal auditory hallucinations, energy increased, difficulty, nightmare, unable to concentrate, homelessness"
840,coronary arteriosclerosis,"pain chest, angina pectoris, shortness of breath, hypokinesia, sweat, sweating increased, pressure chest, dyspnea on exertion, orthopnea, chest tightness"
841,pneumonia,"cough, fever, decreased translucency, shortness of breath, rale, productive cough, pleuritic pain, yellow sputum, breath sounds decreased, chill, rhonchus, green sputum, nonproductive cough, wheezing, haemoptysis, distress respiratory, tachypnea, malaise, night sweat"
842,failure heart congestive,"shortness of breath, orthopnea, jugular venous distention, rale, dyspnea, cough, wheezing"
843,accident cerebrovascular,"dysarthria, asthenia, speech slurred, facial paresis, hemiplegia, unresponsiveness, seizure, numbness"
844,asthma,"wheezing, cough, shortness of breath, chest tightness, nonproductive cough, pleuritic pain, productive cough, symptom aggravating factors, distress respiratory"
845,myocardial infarction,"pain chest, st segment elevation, sweat, sweating increased, shortness of breath, st segment depression, hypokinesia, angina pectoris, pressure chest, t wave inverted, orthopnea, rale, chest tightness, presence of q wave, palpitation, dyspnea, chest discomfort, bradycardia, syncope"
846,hypercholesterolemia,"pain, pain chest, sweat, sweating increased, nonsmoker, pressure chest, syncope, numbness, chest discomfort, shortness of breath, st segment depression, worry, t wave inverted, bradycardia, dyspnea"
